verse_no,spoken_by,sanskrit_text,translation_1,translation_2,translation_3,translation_4,translation_5
4.10,Krishna,वतरगभयकरध मनमय ममपशरत बहव जञनतपस पत मदभवमगत,freed from desire fear and wrath absorbed in me depending upon me purified by the austerity of knowledge many have attained my state,many who were devoid of attachment fear and anger who were absorbed in me who had taken refuge in me and were purified by the austerity of knowledge have attained my state,freed from attachment fear and anger absorbed in me taking refuge in me purified by the fire of knowledge many have attained my being,many persons who are free from passion fear and anger are full of me take refuge in me and have become pure through the austerity of wisdomthey have come to my being,many have merged their existences in mine being freed from desire fear and anger always filled with me and purified by the illuminating flame of selfabnegation
4.11,Krishna,य यथ म परपदयनत तसतथव भजमयहम मम वरतमनवरतनत मनषय परथ सरवश,whoever resorts to me in any manner i favor them in the same manner men experience me alone in different ways o arjuna,according to the manner in which they approach me i favor them in that same manner o son of partha humans follow my path in every way,in whatever way men approach me even so do i reward them my path do men tread in all ways o arjuna,the way in which people resort to me in the same way i favor them o son of prtha all kinds of people follow my path,however men try to worship me i welcome them whatever path they take it leads to me in the end
4.12,Krishna,कङकषनत करमण सदध यजनत इह दवत कषपर ह मनष लक सदधरभवत करमज,those who desire the fruits of their ritualistic acts sacrifice to the gods here for success quickly accrues in the world of men,longing for the fruition of their actions of their rites and duties they worship the gods here for in the human world success from action comes quickly,those who long for success in action in this world sacrifice to the gods for success is quickly attained by men through action,those who desire success in their actions perform sacrifices intending them for the deities for the success born of ritualistic actions is quick in the world of men,those who seek success worship the powers and their actions in this world bear immediate fruit
4.13,Krishna,चतरवरणय मय सषट गणकरमवभगश तसय करतरमप म वदधयकरतरमवययम,the system of four stations was created by me according to the distinction of gunas and karma though i am their creator know me to be nonagent and immutable,the four castes have been created by me through a classification of the gunas and duties even though i am the agent of that act of classification still know me to be nonagentive and changeless,the fourfold caste has been created by me according to the differentiation of guna and karma though i am the author of it know me as nondoer and immutable,i have created the fourfold caste structure according to the division of their respective qualities and actions though i am the creator of this know me as the changeless noncreator,the four divisions of societythe wise the soldier the merchant and the laborerwere created by me according to the natural distribution of qualities and instincts i am the author of them though i myself do not act and am changeless
4.14,Krishna,न म करमण लमपनत न म करमफल सपह इत म यऽभजनत करमभरन स बधयत,works cannot contaminate me there is no desire for the fruits of actions in me he who understands this is not bound by actions,actions do not taint me for i have no hankering for the results of actions one who knows me thus does not become bound by their actions,actions do not taint me nor do i have a desire for the fruit of actions he who knows me thus is not bound by actions,actions do not stain me nor do i have a desire for the fruits of them either whoever understands me in this way is not bound by their actions,my actions do not bind me nor do i desire anything that they can bring he who thus realizes me is not enslaved by action
4.15,Krishna,एव जञतव कत करम परवरप ममकषभ कर करमव तसमततव परव परवतर कतम,knowing thus even ancient seekers of liberation did their work therefore do your work only as the ancients did in olden times,thus having known even the ancient seekers of liberation performed their duties therefore you should undertake action as was performed earlier by the ancients,having known this the ancient seekers of freedom also performed action therefore do thou also perform action as the ancients did in days of yore,realizing in this fashion ancient seekers of salvation also undertook action hence you too should by all means perform the action that was performed by the ancients,in the light of wisdom our ancestors who sought deliverance performed their acts act thou also as our fathers of old did
4.16,Krishna,क करम कमकरमत कवयऽपयतर महत ततत करम परवकषयम यजजञतव मकषयसऽशभत,what is action what is nonaction even the wise are puzzled in respect of these i shall declare to you that kind of action knowing which you will be freed from evil,even the intelligent are confounded as to what is action and what is inaction i shall tell you of that action knowing which you will become free from evil,what is action what is inaction even the wise are confused about this therefore i shall teach you the nature of action and inaction by knowing which you will be liberated from the evil of samsara the wheel of birth and death,even the wise are perplexed about what is action and what is nonaction i shall properly teach you the action by knowing which you will be freed from evil,what is action and what is inaction this is a question that has bewildered the wise but i will declare to you the philosophy of action and knowing it you will be free from evil
4.17,Krishna,करमण हयप बदधवय बदधवय च वकरमण अकरमणशच बदधवय गहन करमण गत,for there is what ought to be known in action likewise there is what ought to be known in multiform action and there is what ought to be understood in nonaction thus mysterious is the way of action,for there is something to be known even about action and something to be known about prohibited action and something needs to be known about inaction the true nature of action is inscrutable,for verily the true nature of action enjoined by the scriptures should be known as well as that of forbidden or unlawful action and of inaction the nature of action is hard to understand,something has to be understood about good action something has to be understood about wrong action and something has to be understood about nonaction it is difficult to comprehend the way of action,it is necessary to consider what is right action what is wrong action and what is inaction for the law of action is mysterious
4.18,Krishna,करमणयकरम य पशयदकरमण च करम य स बदधमन मनषयष स यकत कतसनकरमकत,he who sees inaction in action and also action in inaction is wise among men he is fit for release and has accomplished all actions,he who finds inaction in action and action in inaction is the wise one possessed of the knowledge of brahman among men they are engaged in yoga and are performers of all actions,he who sees inaction in action and action in inaction he is wise among men he is a yogi and performer of all actions,he who finds nonaction in action and action in nonaction is an intelligent one among men and is said to be a performer or destroyer of all actions,he who can see inaction in action and action in inaction is the wisest among men he is a saint even though he still acts
4.19,Krishna,यसय सरव समरमभ कमसङकलपवरजत जञनगनदगधकरमण तमह पणडत बध,he whose every undertaking is free from desire and delusive identification of the body with the self whose actions are burned up in the fire of knowledgethe wise describe him as a sage,the wise call him learned whose actions are all devoid of desires and their thoughts and whose actions have been burned away by the fire of wisdom,he whose undertakings are all devoid of desires and selfish purposes and whose actions have been burned by the fire of knowledge the wise call him a sage,he whose every exertion is devoid of intention for desirable objects and whose actions are burnt up by the fire of wisdomthe wise call such a person a man of learning,the wise call him a sage for whatever he undertakes is free from the motive of desire and his deeds are purified by the fire of wisdom
4.20,Krishna,तयकतव करमफलसङग नतयतपत नरशरय करमणयभपरवततऽप नव कञचतकरत स,having renounced attachment to the fruits of their actions ever contented with the eternal self and dependent on none one does not act at all even while being engaged in action,having given up attachment to the results of action he who is evercontent dependent on nothing does not really do anything even though he is engaged in action,having abandoned attachment to the fruits of the action ever content depending on nothing he does not do anything even while being engaged in activity,by abandoning attachment to the fruits of actions remaining ever content and depending on nothing that person even though they are engaged in action does not perform anything at all,having surrendered all claim to the results of his actions he is always contented and independent in reality he does nothing even though he appears to be acting
4.21,Krishna,नरशरयतचतततम तयकतसरवपरगरह शरर कवल करम करवननपनत कलबषम,free from desire his intellect and mind controlled having given up all possessions and doing bodily work only he is not subject to evil,one who is without solicitation who has the mind and senses under control and is totally without possessions incurs no sin by performing actions merely for the maintenance of the body,without hope controlling the mind and the self having abandoned all covetousness and performing only bodily actions one incurs no sin,having rid of cravings controlling the mind and body abandoning all sense of possession and performing actions with the body alone one does not incur any sin,expecting nothing his mind and personality controlled without greed doing only bodily actions though he acts he remains untainted
4.22,Krishna,यदचछलभसनतषट दवनदवतत वमतसर सम सदधवसदध च कतवप न नबधयत,content with what chance may bring rising above the pairs of opposites free from illwill evenminded in success and failure he acts yet is not bound,remaining satisfied with what comes unasked for having transcended the dualities being free from spite and balanced under success and failure he is not bound even by performing actions,content with what comes to him without effort free from the pairs of opposites and envy evenminded in success and failure he acts yet is not bound,remaining content with the gain brought by chance transcending the dualities pairs of opposites entertaining no jealousy and remaining equal in success and in failure he does not get bound even when he acts,content with what comes to him without any effort of his own rising above the pairs of opposites free from envy his mind balanced in both success and failure though he acts the consequences do not bind him
4.23,Krishna,गतसङगसय मकतसय जञनवसथतचतस यजञयचरत करम समगर परवलयत,one whose attachments have been relinquished who is liberated whose mind is established in knowledge and who works only for sacrificestheir karma is entirely dissolved,the liberated person who has rid themselves of attachment and whose mind is fixed in knowledge has their actions undertaken for a sacrifice completely destroyed,to one who is devoid of attachment who is liberated whose mind is established in knowledge and who works for the sake of sacrifice for the sake of god the whole action is dissolved,the action is completely dissolved in the case of the person who undertakes it for the sake of sacrifice who is free from attachment and has been liberated and whose mind is fixed in wisdom,he who is without attachment free his mind centered in wisdom and his actions done as a sacrifice leave no trace behind
4.24,Krishna,बरहमरपण बरहमहवरबरहमगन बरहमण हतम बरहमव तन गनतवय बरहमकरमसमधन,brahman is the instrument with which to offer brahman is the oblation by brahman is the oblation offered into the fire of brahman brahman alone is to be attained by one who meditates on him in their works,the ladle is brahman the oblations are brahman and the offering is poured by brahman into the fire of brahman he who has concentration on brahman as the objective can only reach brahman,brahman is the oblation brahman is the melted butter ghee by brahman is the oblation poured into the fire of brahman brahman indeed shall be attained by one who always sees brahman in action,the brahmanoblation that is to be offered to the brahman is poured into the brahmanfire by the brahman it is nothing but the brahman that is to be attained by one whose deep contemplation is the brahmanaction,for him the sacrifice is the spirit the spirit and the offering are one it is the spirit that is sacrificed in its own fire and the man even in action is united with god since his mind never ceases to be fixed on him while performing the act
4.25,Krishna,दवमवपर यजञ यगन परयपसत बरहमगनवपर यजञ यजञनवपजहवत,some yogis resort only to the sacrifice relating to gods others offer sacrifice into the fire of brahman solely through sacrifice,other yogis undertake sacrifice to gods alone while others offer the self as a sacrifice by themselves in the fire of brahman,some yogis perform sacrifice to the gods alone while others who have realized the self offer the self as sacrifice in the fire of brahman alone,certain other men of yoga are completely devoted to yajna connected with the devas and offer that yajna simply as a yajna into the insatiable fire of the brahman,some sages sacrifice to the powers while others offer themselves on the altar of the eternal
4.26,Krishna,शरतरदननदरयणयनय सयमगनष जहवत शबददनवषयननय इनदरयगनष जहवत,others offer as oblations hearing and other senses into the fires of restraint some others offer as oblations the objects of the senses such as sound and the rest into the fires of their senses,others offer their organs such as their ears etc in the fires of selfcontrol others offer the objects such as sound etc in the fires of their organs,some again offer the organ of hearing and other senses as a sacrifice in the fire of restraint others offer sound and other objects of the senses as a sacrifice in the fire of the senses,others offer their senseorgans such as the sense of hearing and the rest into the fires of restraint others offer objects such as sound and the rest into the fires of their senseorgans,some sacrifice their physical senses in the fire of selfcontrol others offer up their contact with external objects in the sacrificial fire of their senses
4.27,Krishna,सरवणनदरयकरमण परणकरमण चपर आतमसयमयगगन जहवत जञनदपत,some again offer as an oblation the functions of the senses and the activity of the vital breaths into the fire of the yoga of restraint of the mind kindled by knowledge,others offer all the activities of the organs and the activities of the vital force into the fire of the yoga of selfcontrol lit by knowledge,others again sacrifice all the functions of the senses and those of the breath vital energy or prana in the fire of the yoga of selfrestraint kindled by knowledge,some others offer all the actions of their senseorgans and the actions of their lifebreath into the fire of the yoga of selfcontrol ignited by wisdom,others again sacrifice their activities and vitality in the spiritual fire of selfabnegation kindled by wisdom
4.28,Krishna,दरवययजञसतपयजञ यगयजञसतथपर सवधययजञनयजञशच यतय सशतवरत,selfcontrolled and firm of resolve others perform the sacrifice of material objects or austerities or yoga while others offer their scriptural study and knowledge,similarly others are performers of sacrifices through wealth through austerity through yoga and through study and knowledge others are ascetics with severe vows,others again offer wealth austerity and yoga as sacrifice while ascetics of selfrestraint and rigid vows offer the study of scriptures and knowledge as sacrifice,these are the performers of sacrifices with material objects the performers of sacrifices with penance and the performers of sacrifices with yoga likewise there are other ascetics with rigid vows whose sacrifices are the svadhyayaknowledge,others offer as their sacrifice wealth austerities and meditation monks wedded to their vows renounce their scriptural learning and even their spiritual powers
4.29,Krishna,अपन जहवत परण परणऽपन तथऽपर परणपनगत रदधव परणयमपरयण,others with restricted diets are devoted to the control of breath some sacrifice the inward breath in the outward breath similarly others sacrifice the outward breath in the inward breath some others stopping the flow of both the inward and outward breaths sacrifice the inward and outward breaths,constantly practicing control of the vital forces by stopping the movements of the outgoing and incoming breaths some offer as a sacrifice the outgoing breath into the incoming breath while still others the incoming breath into the outgoing breath,others offer as sacrifice the outgoing breath into the incoming and the incoming into the outgoing restraining the flow of the outgoing and the incoming breaths solely absorbed in the restraint of the breath,some sages offer the prana into the apana likewise others offer the apana into the prana having controlled both the courses of the prana and apana the same sages with their desires fulfilled by the above activities and with their food restricted offer the pranas into pranas all these persons know what sacrifices are and have their sins destroyed by them,there are some who practice controlling the vital energy and governing the subtle forces of prana and apana thereby sacrificing their prana to apana or their apana to prana
4.30,Krishna,अपर नयतहर परणनपरणष जहवत सरवऽपयत यजञवद यजञकषपतकलमष,all these know the meaning of sacrifices and through sacrifices their sins are eradicated those who subsist on the ambrosial food the remnants of sacrifices go to eternal brahman,others having their food regulated offer the vital forces in the vital forces all of them are knowers of the sacrifice and have their sins destroyed by the sacrifice,others who regulate their diet offer lifebreaths in each lifebreath all these are knowers of sacrifice whose sins are destroyed through sacrifice,some sages offer the prana into the apana likewise others offer the apana into the prana having controlled both the courses of the prana and apana the same sages with their desires fulfilled by the above activities and with their food restricted offer the pranas into pranas all these persons know what sacrifices are and have their sins destroyed by them,others controlling their diet sacrifice their worldly life to the spiritual fire all understand the principle of sacrifice and by it their sins are washed away
4.31,Krishna,यजञशषटमतभज यनत बरहम सनतनम नय लकऽसतययजञसय कतऽनय करसततम,this world is not for one who makes no sacrifice how then for the other o arjuna,those who partake of the nectar left over after a sacrifice reach the eternal brahman this world ceases to exist for one who does not perform sacrifices what then to speak of the other world o best among the kurus arjuna,those who eat the remnants of the sacrifice which are like nectar go to the eternal brahman this world is not for the one who does not perform sacrifice how then can they have the other o arjuna,the eaters of the sacrificeordained nectar attain the eternal brahman this world is not for a nonsacrificer how can there be the other o best of the kurus,tasting the nectar of immortality as the reward of sacrifice they reach the eternal this world is not for those who refuse to sacrifice nor is the other world
4.32,Krishna,एव बहवध यजञ वतत बरहमण मख करमजनवदध तनसरवनव जञतव वमकषयस,thus many forms of sacrifices have been spread out as means of reaching brahman individual self in its own nature know that all of these are born of actions knowing thus you will be free,thus various kinds of sacrifices are spread at the mouth of the vedas know them all to be born of action knowing this you will become liberated,thus manifold sacrifices are spread out before brahman at the face of brahman know them all to be born of action and thus knowing you shall be liberated,thus sacrifices of many varieties have been elaborated upon by the mouth of the brahman know them all as having sprung from actions by knowing thus you shall be liberated,in this way other sacrifices may also be undertaken for the sake of the spirit know that they all depend on action knowing this you will be free
4.33,Krishna,शरयनदरवयमयदयजञजजञनयजञ परनतप सरव करमखल परथ जञन परसमपयत,the sacrifice of knowledge is superior to material sacrifice o arjuna all actions and everything else culminate in knowledge,o destroyer of enemies knowledge considered as a sacrifice is greater than sacrifices requiring materials o son of prtha all actions in their totality culminate in knowledge,superior is wisdomsacrifice to the sacrifice with objects o parantapa scorcher of the foes all actions in their entirety o arjuna culminate in knowledge,the sacrifice of knowledge is superior to the sacrifice of material things o son of prtha destroyer of enemies all actions leaving nothing behind come to an end in knowledge,the sacrifice of wisdom is superior to any material sacrifice for o arjuna the pinnacle of action is always realization
4.34,Krishna,तदवदध परणपतन परपरशनन सवय उपदकषयनत त जञन जञननसतततवदरशन,know this through prostration questioning and service the wise who have realized the truth will instruct you in knowledge,know that the wise ones who have realized the truth will impart the knowledge to you through prostration inquiry and service,know that the wise who have realized the truth will instruct thee in that knowledge through long prostration supplication and service,learn this from those endowed with knowledge through prostration inquiry and service offered to them those who are endowed with knowledge and are capable of showing the truth will give you the truth nearby,this you shall learn by prostrating yourself at the masters feet questioning them and serving them the wise who have realized the truth will teach you wisdom
4.35,Krishna,यजजञतव न पनरमहमव यसयस पणडव यन भतनयशषण दरकषयसयतमनयथ मय,knowing this o arjuna you will not fall again into delusion in this wayby that knowledge you will see all beings without exception in yourself and then in me,knowing this o pandava you will not be deluded again in this way and through it you will see all beings without exception in the self and also in me,knowing that thou shalt not o arjuna again be deluded like this and by that thou shalt see all beings in thyself and also in me,by knowing this you will not be deluded again o son of pandu and by this means you will see all beings without exception in yourself that is in me,having known that you shall never again be confounded and o arjuna by the power of that wisdom you shall see all these people as if they were your own self and therefore as me
4.36,Krishna,अप चदस पपभय सरवभय पपकततम सरव जञनपलवनव वजन सनतरषयस,even if you are the most sinful of all sinners you can cross over all sins by the boat of knowledge alone,even if you are the worst sinner among all sinners you can still cross over all wickedness with the raft of knowledge alone,even if thou art the most sinful of all sinners yet thou shalt surely cross over all sins by the raft of knowledge,even if you are the highest sinner among all sinners you can cross over the ocean of all sins by the boat of knowledge,even if you are the greatest of sinners you will cross over all sin by the ferryboat of wisdom
