verse_no,spoken_by,sanskrit_text,translation_1,translation_2,translation_3,translation_4,translation_5
8.26,Krishna,शकलकषण गत हयत जगत शशवत मत एकय यतयनवततमनययऽऽवरतत पन,these two paths of the world which are white and black are indeed considered eternal through one a person goes to the state of nonreturn through the other they return again,these two paths of the world which are white and black are indeed considered eternal through one a person goes to the state of nonreturn through the other they return again,the bright and dark paths of the world are thought to be eternal one leads to no return and the other leads to return,for these two bright and dark paths are considered to be perpetual for the world one attains nonreturn by the first of these and one returns back by the other,these bright and dark paths out of the world have always existed whoever takes the former does not return he who chooses the latter returns
8.27,Krishna,नत सत परथ जननयग महयत कशचन तसमतसरवष कलष यगयकत भवरजन,o son of prtha no yogione steadfast in meditationwhosoever has known these two courses becomes deluded therefore o arjuna be steadfast in yoga at all times,o son of prtha no yogione steadfast in meditationwhosoever has known these two courses becomes deluded therefore o arjuna be steadfast in yoga at all times,knowing these paths o arjuna no yogi is deluded therefore at all times be steadfast in yoga,o son of prtha no yogin knowing these two courses gets deluded therefore o arjuna practice yoga connected with all times,o arjuna the saint knowing these paths is not confused therefore meditate perpetually
8.28,Krishna,वदष यजञष तपस चव दनष यतपणयफल परदषटम अतयत ततसरवमद वदतव यग पर सथनमपत चदयम,having known this the yogi transcends all the results of righteous deeds declared in the vedas sacrifices austerities and charities and reaches the primordial supreme state,having known this the yogi transcends all the results of righteous deeds declared in the vedas sacrifices austerities and charities and reaches the primordial supreme state,whatever fruit of merit is declared in the scriptures to accrue from the study of the vedas the performance of sacrifices the practice of austerities and gifts beyond all this goes the yogi having known this and he attains to the supreme primeval first or ancient abode,having understood all this the yogin goes beyond whatever fruit of merit is ordained in the scriptures in case of reciting the vedas performing sacrifices observing austerities and donating gifts and he goes to the supreme primeval abode,the sage who knows this passes beyond all merit that comes from the study of the scriptures from sacrifice from austerities and from charity and reaches the supreme primeval abode
9.1,Krishna,इद त त गहयतम परवकषयमयनसयव जञन वजञनसहत यजजञतव मकषयसऽशभत,the lord said i shall declare to you who does not cavil this most mysterious knowledge together with its special knowledge knowing which you will be freed from evil,the blessed lord said however to you who are not given to cavilling i shall speak of this highest secret itself which is knowledge combined with experience by realizing which you shall be free from evil,the blessed lord said i shall now declare to thee who does not cavil the greatest secretthe knowledge combined with experience selfrealisation having known this thou shalt be free from evil,the bhagavat said to you who are entertaining no displeasure i shall clearly declare this most secret knowledge together with action by knowing which you shall be free from evil,lord shri krishna said i will now reveal to you since you do not doubt that profound mysticism which when followed with experience will liberate you from sin
9.2,Krishna,रजवदय रजगहय पवतरमदमततमम परतयकषवगम धरमय ससख करतमवययम,this is the royal science the royal mystery the supreme purifier it is realized through direct experience is in accord with dharma is pleasant to practice and is abiding,this is the sovereign knowledge the sovereign profundity the best sanctifier directly realizable righteous very easy to practice and imperishable,this is the royal science the royal secret the supreme purifier realizable by direct intuitive knowledge according to righteousness very easy to perform and imperishable,this shines among the sciences it is the secret of monarchs it is a supreme purifier comprehensible by immediate perception righteous easy to do and imperishable,this is the supreme science the supreme secret the purest and best it is intuitive righteous and to those who practice it it is exceedingly pleasant
9.3,Krishna,अशरददधन परष धरमसयसय परनतप अपरपय म नवरतनत मतयससरवरतमन,men devoid of faith in this dharma o scorcher of foes ever remain without attaining me on the mortal path of samsara,o destroyer of foes those who are disregarding this dharma knowledge of the self certainly go round and round without reaching me along the path of transmigration which is fraught with death,those who have no faith in this dharma o parantapa return to the path of this world without attaining me,o scorcher of foes those who have no faith in this dharma do not attain me and remain eternally in the cycle of mundane existence fraught with death,they who have no faith in this teaching cannot find me they remain lost in the purlieus of this perishable world
9.4,Krishna,मय ततमद सरव जगदवयकतमरतन मतसथन सरवभतन न चह तषववसथत,this entire universe is pervaded by me in an unmanifest form all beings abide in me but i do not abide in them,this whole world is pervaded by me in my unmanifest form all beings exist in me but i am not contained within them,all of this world is pervaded by me in my unmanifest aspect all beings exist within me but i do not dwell within them,this entire universe is pervaded by me having an unmanifest form all beings exist in me and i do not exist in them,the whole world is pervaded by me yet my form is not visible all living beings have their being in me yet i am not confined by them
9.5,Krishna,न च मतसथन भतन पशय म यगमशवरम भतभनन च भतसथ ममतम भतभवन,yet beings do not remain in me behold my divine yoga i am the sustainer of all beings yet i am not in them it is my will alone that causes their existence,neither do the beings dwell in me behold my divine yoga i am the sustainer and originator of beings but my self is not contained within the beings,nor do beings exist in me in reality behold my divine yoga which supports all beings but does not dwell in them is my self the efficient cause of beings,yet the beings do not exist in me look at my sovereign yoga my self is the sustainer of the beings it does not exist in them and causes them to be born,nevertheless they do not consciously abide in me such is my divine sovereignty that though i the supreme self am the cause and upholder of all yet i remain outside
9.6,Krishna,यथऽऽकशसथत नतय वय सरवतरग महन तथ सरवण भतन मतसथनतयपधरय,as the powerful element air moving everywhere ever remains in the ether know that so too all beings abide in me,understand thus that just as the voluminous wind moving everywhere is ever present in space similarly all beings abide in me,as the mighty wind moving everywhere always rests in the ether so too know that all beings rest in me,just as the mighty wind exists in the ether always moving therein everywhere in the same manner all beings exist in me be sure of it,as the mighty wind though moving everywhere has no resting place except in space so all these beings have no home except in me
9.7,Krishna,सरवभतन कनतय परकत यनत ममकम कलपकषय पनसतन कलपद वसजमयहम,all beings o arjuna enter into my prakriti at the end of a cycle of time again i send them forth at the beginning of a cycle of time,o son of kunti all the beings at the end of a cycle go back to my prakrti at the beginning of a cycle i project them forth again,all beings o arjuna go into my nature at the end of a kalpa i send them forth again at the beginning of the next kalpa,o son of kunti all beings pass into my nature at the end of the kalpa the age of universe i send them forth again at the beginning of the next kalpa,all beings o arjuna return at the end of every cosmic cycle into the realm of nature which is a part of me and at the start of the next i send them forth again
9.8,Krishna,परकत सवमवषटभय वसजम पन पन भतगरममम कतसनमवश परकतरवशत,controlling the prakṛti which is my own i send forth again and again this multitude of beings helpless under the sway of prakṛti,keeping my own prakṛti under control i project forth again and again this multitude of beings which are powerless due to the influence of their own nature,animating my nature i again and again send forth all this multitude of beings helpless under the force of nature,taking hold of my own nature i again and again send forth this entire host of beings which is powerless under the control of my nature,with the help of nature i again and again pour forth the whole multitude of beings whether they will or not for they are ruled by my will
9.9,Krishna,न च म तन करमण नबधननत धनञजय उदसनवदसनमसकत तष करमस,but these actions do not bind me o arjuna for i remain detached from them as if i were unconcerned,o dhananjaya those actions do not bind me for i remain unconcerned and unattached to them,these acts do not bind me o arjuna sitting as one indifferent unattached to those acts,o dhananjaya these acts do not bind me remaining as if unconcerned and unattached in these actions,but these acts of mine do not bind me i remain outside and unattached
9.10,Krishna,मयऽधयकषण परकत सयत सचरचरम हतनऽनन कनतय जगदवपरवरतत,under my supervision prakrti gives birth to all mobile and immobile entities and thus o arjuna the world revolves,under me as the supervisor the prakrti produces the world of the moving and the nonmoving things owing to this o son of kunti the world revolves,under me as supervisor nature produces the moving and the unmoving therefore o arjuna the world revolves,o son of kunti on account of me who remain only as an observer and the prime cause my nature gives birth to both the moving and the unmoving hence this world moves in a circle,under my guidance nature produces all movable and immovable things thus o arjuna this universe revolves
9.11,Krishna,अवजननत म मढ मनष तनमशरतम पर भवमजननत मम भतमहशवरम,fools disregard me dwelling in a human form not knowing my higher nature as the supreme lord of all beings,not knowing my supreme nature as the lord of all beings foolish people disregard me who have taken a human form,fools disregard me clad in human form not knowing my higher being as the great lord of all beings,unaware of my immutable highest absolute supreme nature the deluded ones disregard me dwelling in the human body,fools disregard me seeing me clad in human form they do not know that in my higher nature i am the lordgod of all
9.12,Krishna,मघश मघकरमण मघजञन वचतस रकषसमसर चव परकत महन शरत,senseless people have a nature that is deluding and similar to that of rakshasas and asuras their hopes are futile their actions are futile and their knowledge is futile,possessed of vain hopes vain actions vain knowledge and senselessness they become verily possessed of the deceptive disposition of fiends and demons,they are possessed of the deceitful nature of demons and undivine beings filled with vain hopes vain actions and vain knowledge that is senseless,they are of futile aspirations futile actions futile knowledge and wrong intellect and they take recourse only to the delusive nature that is both demoniac and devilish,their hopes are futile their actions worthless their knowledge ineffective they are without sense deceitful barbaric and godless
9.13,Krishna,महतमनसत म परथ दव परकतमशरत भजनतयननयमनस जञतव भतदमवययम,but the greatsouled ones o arjuna who are associated with my divine nature worship me with an unwavering mind knowing me to be the immutable source of all beings,o son of prtha the noble ones being possessed of divine nature surely adore me with singlemindedness knowing me to be the immutable source of all objects,but the great souls o arjuna partaking of my divine nature worship me with a singleminded devotion knowing me as the imperishable source of all beings,o son of prtha the greatsouled men however taking hold of the divine nature and having nothing else in their minds adore me viewing me as the imperishable prime cause of beings,but the great souls o arjuna filled with my divine spirit they worship me fix their minds on me alone for they know that i am the imperishable source of being
9.14,Krishna,सतत करतयनत म यतनतशच दढवरत नमसयनतशच म भकतय नतययकत उपसत,aspiring for eternal communion with me they worship me always singing my praises striving with steadfast resolution and bowing down to me in devotion,always glorifying me and striving the men of firm vows worship me by paying obeisance to me and being ever endowed with devotion,always glorifying me striving firm in their vows prostrating themselves before me they worship me with steadfast devotion,ever speaking of my glory striving with firm resolve paying homage to me and being permanently endowed with devotion they worship me,always extolling me they are strenuous and firm in their vows prostrating themselves before me and worshiping me continually with concentrated devotion
9.15,Krishna,जञनयजञन चपयनय यजनत ममपसत एकतवन पथकतवन बहध वशवतमखम,others besides offering the sacrifice of knowledge also worship me as one who is characterized by diversity in countless ways and is multiform in my cosmic aspect,others indeed worship me by exclusively adoring through the sacrifice of the knowledge of oneness others worship me in many ways and others as the multiform existing in various forms,others also sacrificing with the wisdomsacrifice worship me the allfaced as one distinct and manifold,some worship me by knowledgesacrifice and others by offering sacrifices thus they worship me the universallyfaced either as one or as many,others worship me with full consciousness as the one the manifold the omnipresent and the universal
9.16,Krishna,अह करतरह यजञ सवधऽहमहमषधम मतरऽहमहमवजयमहमगनरह हतम,i am kratu i am the sacrifice i am the offering to the manes i am the herb i am the mantra i am the clarified butter i am the fire i am the oblation,i am the ritual i am the sacrifice i am the oblation i am the medicinal herb i am the mantra i am the clarified butter i am the fire and i am the act of offering,i am kratu i am yajna i am the offering to the manes i am the medicinal herbs and all plants i am the mantra i am also the ghee or melted butter i am the fire i am the oblation,i am determination i am sacrifice i am svadha i am the juice of the herb i am the vedic hymn i am also the clarified butter i am the sacrificial fire and i am the act of offering,i am the oblation the sacrifice and the worship i am the fuel and the chant i am the butter offered to the fire i am the fire itself and i am the act of offering
9.17,Krishna,पतऽहमसय जगत मत धत पतमह वदय पवतरमकर ऋक सम यजरव च,i am the father mother creator and grandfather of the universe i am the purifier i am the syllable om as well as rk saman and yajus,of this world i am the father mother ordainer and grandfather i am the knowable the sanctifier the syllable om as well as the rk sama and yajus,i am the father of this world the mother the dispenser of the fruits of actions and the grandfather the one thing to be known the purifier the sacred monosyllable om and also the rik sama and yajur vedas,i am the father the mother the sustainer and the paternal grandparent of this world i am the sacred object of knowledge the syllable om the rk the saman and the yajus as well,i am the father of the universe its mother nourisher and grandfather i am the knowable and the pure i am om and i am the sacred scriptures
9.18,Krishna,गतरभरत परभ सकष नवस शरण सहत परभव परलय सथन नधन बजमवययम,i am the goal the supporter the lord the witness the abode the refuge and the friend i am the origin the dissolution the basis for preservation and the imperishable seed,i am the fruit of actions the nourisher the lord witness abode refuge friend origin end foundation store and the imperishable seed,i am the goal the supporter the lord the witness the abode the shelter the friend the origin the dissolution the foundation the treasurehouse and the imperishable seed,i am the method the nourisher the lord the witness the abode the refuge the goodhearted friend the origin the dissolution the sustenance the repository and the imperishable seed of the world,i am the goal the sustainer the lord the witness the home the shelter the lover and the origin i am life and death i am the fountain and the imperishable seed
9.19,Krishna,तपमयहमह वरष नगहणमयतसजम च अमत चव मतयशच सदसचचहमरजन,i give heat i withhold and send forth the rain i am immortality and also death o arjuna i am the being and the nonbeing,o arjuna i give heat i withhold and pour down rain i am verily the nectar and also death existence and nonexistence,as the sun i give heat i withhold and send forth the rain i am immortality and also death existence and nonexistence o arjuna,i give heat i withhold and also send forth rains i am immortality and also death the real and the unreal o arjuna,i am the heat of the sun i release and withhold the rain i am death and immortality i am being and nonbeing
9.20,Krishna,तरवदय म समप पतपप यजञरषटव सवरगत पररथयनत त पणयमसदय सरनदरलक मशननत दवयनदव दवभगन,those who are versed in the three vedas having been purified from sin by drinking the soma juice pray for passage to heaven and worship me through sacrifices reaching the holy realm of the chief of the gods they enjoy celestial pleasures in heaven,those who are versed in the vedas who drink soma and are purified of sin pray for the heavenly goal by worshipping me through sacrifices having reached the place world of the king of gods which is the result of righteousness they enjoy the divine pleasure of the gods in heaven,the knowers of the three vedas the drinkers of soma purified of all sins worshipping me through sacrifices pray for the way to heaven they reach the holy world of the lord of the gods and enjoy the divine pleasures of the gods in heaven,the masters of the three vedas the somadrinkers purified of their sins aspire for the heavenly goal by offering sacrifices to me they attain the meritorious world of the lord of gods and taste in the heavens the heavenly pleasures of the gods,those who are versed in the scriptures who drink the mystic somajuice and are purified from sin and who while worshipping me with sacrifices pray that i will lead them to heaven they reach the holy world where the controller of the powers of nature resides and they enjoy the feasts of paradise
9.21,Krishna,त त भकतव सवरगलक वशल कषण पणय मरतयलक वशनत एव तरयधरममनपरपनन गतगत कमकम लभनत,having enjoyed the spacious world of heaven they return to the world of mortals their merit having been exhausted thus those who follow the vedic rituals and are drawn by desires come and go,after having enjoyed that vast heavenly world they enter into the human world upon the exhaustion of their merit thus those who follow the rites and duties prescribed in the three vedas and are desirous of pleasures attain the state of coming and going,they having enjoyed the vast heaven enter the world of mortals when their merit is exhausted thus abiding by the injunctions of the three vedas and desiring objects of desires they attain to the state of coming and going,having enjoyed that vast world of heaven they when their merit is exhausted enter the world of mortals thus those who long for pleasure and continuously take refuge in the code of conduct prescribed by the three vedas attain the state of going and coming,yet although they enjoy the spacious glories of paradise when their merit is exhausted they are born again into this world of mortals they have followed the letter of the scriptures yet because they have sought to fulfill their own desires they must depart and return again and again
9.22,Krishna,अननयशचनतयनत म य जन परयपसत तष नतयभयकतन यगकषम वहमयहम,those who excluding all else think of me and worship me aspiring after eternal union with me i look after their prosperity and welfare yoga and ksema,those persons who becoming nondifferent from me and meditating worship me everywhere for them who are ever attached to me i arrange for securing what they lack and preserving what they have,for those men who worship me alone thinking of no one else for those everunited i secure what they have not already possessed and preserve what they already possess,those men who having nothing else as their goal worship me everywhere and are constantly thinking of me alone to them who are fully and constantly attached to me i bear acquisition and the security of acquisition,but if a person meditates on me and me alone worships me always and everywhere i will take upon myself the fulfillment of their aspiration and i will safeguard whatever they attain
9.23,Krishna,यऽपयनयदवत भकत यजनत शरदधयऽनवत तऽप ममव कनतय यजनतयवधपरवकम,even those who are devoted to other divinities with faith in their hearts worship me alone o arjuna though not in accordance with the sastras,even those who being devoted to other deities and endowed with faith worship them they also o son of kunti worship me alone though following the wrong method,even those devotees who endowed with faith worship other gods worship me alone o arjuna but by the wrong method,o son of kunti even those who are devotees of other gods and worship them with faith worship me alone but following noninjunctive practices,even those who worship the lesser powers if they do so with faith they are thereby worshipping me though not in the correct manner
9.24,Krishna,अह ह सरवयजञन भकत च परभरव च न त ममभजननत तततवनतशचयवनत त,for i am the only enjoyer and the only lord of all sacrifices they do not recognize me in my true nature hence they fall,indeed i am the enjoyer and the lord of all sacrifices but they do not know me truly therefore they fall,for i alone am the enjoyer and lord of all sacrifices but they do not know me in reality and thus they return to this mortal world,for i am the enjoyer and the lord of all sacrifices yet they do not recognize me correctly and thus they turn away,i am the willing recipient of sacrifice and i am its true lord but they do not know me truly so they fall back
9.25,Krishna,यनत दववरत दवन पतनयनत पतवरत भतन यनत भतजय यनत मदयजनऽप मम,devotees of gods go to the gods manesworshippers go to the manes worshippers of bhutas go to the bhutas and those who worship me come to me,those who worship the gods reach the gods the worshippers of the manes go to the manes the devotees of the beings reach the beings and those who worship me come to me,the worshippers of the gods go to them the ancestorworshippers go to the manes the worshippers of the deities who preside over the elements go to them but my devotees come to me,the devotees of the gods attain the gods the devotees of the ancestors attain the ancestors those who perform sacrifices for the spirits attain the spirits and those who perform sacrifices for me attain me,the votaries of the lesser powers go to them the devotees of spirits go to them they who worship the powers of darkness to such powers shall they go and so too those who worship me shall come to me
