verse_no,spoken_by,sanskrit_text,translation_1,translation_2,translation_3,translation_4,translation_5
1.1,Dhritrashtra,धरमकषतर करकषतर समवत ययतसव ममक पणडवशचव कमकरवत सञजय,dhṛtarāṣṭra said o sanjaya what did my people and the pāṇḍavas do gathered together on the holy field of kurukshetra eager for battle,dhṛtarāṣṭra said o sanjaya what did my sons and the sons of pandu do when they assembled on the sacred field of kurukshetra eager for battle,dhritarashtra said what did my people and the sons of pandu do when they had assembled together eager for battle on the holy plain of kurukshetra o sanjaya,dhritarashtra said o sanjaya what did my sons and the sons of pandu do in the kurukshetra the field of righteousness where the entire warring class had assembled,the king dhritarashtra asked o sanjaya what happened on the sacred battlefield of kurukshetra when my people and the pandavas gathered
1.2,Sanjay,दषटव त पणडवनक वयढ दरयधनसतद आचरयमपसङगमय रज वचनमबरवत,sanjaya said king duryodhana upon seeing the pandava army in battle array approached his teacher drona and said these words,sanjaya said but then seeing the army of the pandavas in battle array king duryodhana approached the teacher drona and spoke,sanjaya said having seen the army of the pandavas drawn up in battle array king duryodhana approached his teacher drona and spoke these words,sanjaya said seeing the army of the sons of pandu marshaled in military array the prince duryodhana approached the teacher drona and spoke these words at that time,sanjaya replied when prince duryodhana saw the pandavas army paraded he approached his preceptor guru drona and spoke these words
1.3,Sanjay,पशयत पणडपतरणमचरय महत चमम वयढ दरपदपतरण तव शषयण धमत,behold o teacher this mighty army of the pandavas arrayed by the son of drupada your intelligent disciple,o teacher behold this vast army of the sons of pandu arrayed for battle by the intelligent disciple of drupada,behold o teacher this mighty army of the sons of pandu arrayed by the son of drupada thy wise disciple,o teacher behold this mighty army of the sons of pandu marshaled in a military array by drupadas son your intelligent pupil,revered father behold this mighty host of the pandavas paraded by the son of king drupada your wise disciple
1.4,Sanjay,अतर शर महषवस भमरजनसम यध ययधन वरटशच दरपदशच महरथ,there in that army are heroes great bowmen such as bhima and arjuna yuyudhana virata and drupada a mighty warrior,here are the heroes wielding great bows who in battle are peers of bhima and arjuna yuyudhana satyaki and virata and the maharatha great chariotrider drupada,here are heroes mighty archers equal in battle to bhima and arjuna yuyudhana satyaki virata and drupadaall mighty warriors,here are the heroes and mighty archers comparable in war to bhima and arjuna yuyudhana the king of the virata country and drupada the mighty warrior,in it are heroes and great bowmen the equals in battle of arjuna bheema yuyudhana virata and drupadaall great soldiers
1.5,Sanjay,धषटकतशचकतन कशरजशच वरयवन परजतकनतभजशच शबयशच नरपङगव,dhrstaketu cekitana the valiant king of kasi purujit kuntibhoja and saibya the best among men,dhrstaketu cekitana and the valiant king of kasi varanasi purujit kuntibhoja and saibya the choicest of men,dhrishtaketu chekitana the valiant king of kasi purujit kuntibhoja and saibyathe best of men,dhrstaketu cekitana the valorous king of kasi kuntibhoja the conqueror of many and the sibi king the best among men,dhrishtaketu chekitan the valiant king of benares purujit kuntibhoja and shaibyaa master of many
1.6,Sanjay,यधमनयशच वकरनत उततमजशच वरयवन सभदर दरपदयशच सरव एव महरथ,yudhamanyu the valiant one and uttamaujas the strong one and also the son of subhadra as well as the sons of draupadi all mighty warriors,and the valiant yudhamanyu and the chivalrous uttamaujas the son of subhadra abhimanyu and the sons of draupadiall of them are indeed maharathas,the strong yudhamanyu and the brave uttamaujas the son of subhadra abhimanyu the son of subhadra and arjuna and the sons of draupadi all of them great charioteers great heroes,and yudhamanyu the heroic and uttamaujas the valiant the son of subhadra and the sons of draupadiall of them are indeed mighty warriors,yudhamanyu uttamouja soubhadra and the sons of droupadiall famous men
1.7,Sanjay,असमक त वशषट य तननबध दवजततम नयक मम सनयसय सजञरथ तनबरवम त,know o best of brahmanas those who are important on our sidethose who are the commanders of my army i shall name them to refresh your memory,but o best among the brahmanas please be appraised of those who are foremost among us the founders of my army i speak of them to you by way of illustration,know also o best among the twiceborn the names of those who are the most distinguished amongst ourselves the leaders of my army these i name to you for your information,o best among the twiceborn please take note of the most distinguished amongst us who are the generals of my army and who are accepted as leaders by the heroes in my mighty army i shall name them to you,further take note of all those captains who have ranged themselves on our side o best of spiritual guides the leaders of my army i will name them for you
1.8,Sanjay,भवनभषमशच करणशच कपशच समतञजय अशवतथम वकरणशच समदततसतथव च,yourself bhisma karna the victorious krpa asvatthama vikarna and jayadratha the son of somadatta,they are your venerable self bhisma karna and krpa who is ever victorious in battle asvatthama vikarna saumadatti and jayadratha,thou thyself bhishma karna kripa the victorious in war asvatthama vikarna and bhurisrava the son of somadattaall these are ready for battle,your good self bhisma karna krpa salya jayadratha asvatthaman vikarna and somadattas son the valiant ones,you come first then bheeshma karna kripa great warriors ashwaththama vikarna and the son of somadhatta
1.9,Sanjay,अनय च बहव शर मदरथ तयकतजवत ननशसतरपरहरण सरव यदधवशरद,and there are many other heroes who are determined to give up their lives for my sake they are all experts in using manifold missiles and dexterous in battle,there are many heroes who have dedicated their lives to me possessing various kinds of weapons and missiles all of whom are skilled in battle,and also many other heroes ready to give up their lives for my sake armed with various weapons and missiles all wellskilled in battle,and many other heroes giving up their lives for my sake fighting with various weapons all highly skilled in different forms of warfare,and many others all ready to die for my sake all armed all skilled in warfare
1.10,Sanjay,अपरयपत तदसमक बल भषमभरकषतम परयपत तवदमतष बल भमभरकषतम,our force is inadequate guarded by bhisma while their force is adequate guarded by bhima,therefore our army under the complete protection of bhisma and others is limitless but this army of the enemies under the protection of bhima and others is limited,our army marshalled by bhishma is insufficient whereas theirs marshalled by bhima is sufficient,thus the army guarded by bhima is unlimited for us whereas the army guarded by bhisma is sufficient for them the pandavas,yet our army seems weaker though commanded by bhishma their army seems stronger though commanded by bhima
1.11,Sanjay,अयनष च सरवष यथभगमवसथत भषममवभरकषनत भवनत सरव एव ह,therefore all of you taking your places firmly in your respective divisions should guard bhisma at all costs,however venerable sirs all of you without exception while occupying all the positions in the different directions as allotted to you respectively please protect bhisma in particular,therefore do all of you stationed in your respective positions in the several divisions of the army protect bhishma alone,stationed firmly in all their respective paths each one of them should guard bhisma above all without exception,therefore let the rank and file stand firm in their posts according to battalions and all you generals around bheeshma
1.12,Sanjay,तसय सजनयनहरष करवदध पतमह सहनद वनदयचच शङख दधम परतपवन,then the valiant grandsire bhisma the seniormost of the kuru clan roared like a lion and blew his conch with the intention of cheering up duryodhana,the valiant grandfather the eldest of the kurus loudly sounding a lions roar blew the conch to raise his duryodhanas spirits,his glorious grandsire the oldest of the kauravas roared like a lion to cheer duryodhana and blew his conch,generating joy in him the powerful paternal grandfather bhisma the seniormost among the kurus roared like a lion and blew his conchshell loudly,then to enliven his spirits the brave grandfather bheeshma the eldest of the kuru clan blew his conch its sound resembling that of a lions roar
1.13,Sanjay,तत शङखशच भरयशच पणवनकगमख सहसवभयहनयनत स शबदसतमलऽभवत,then suddenly conchs kettle drums trumpets tabors and blow horns blared forth and the sound was terrific,just immediately afterward conch shells kettledrums tabors trumpets and cowhorns blared forth creating a tumultuous sound,then suddenly conches kettledrums tabors drums and cow horns blared forth from the kaurava side and the sound was tremendous,then all of a sudden the conchshells drums tambourines trumpets and cowhorns sounded in unison the sound was tumultuous,and immediately all the conches drums trumpets and horns blared forth in a tumultuous uproar
1.14,Sanjay,तत शवतरहयरयकत महत सयनदन सथत मधव पणडवशचव दवय शङख परदधमत,then sri krishna and arjuna stationed in their great chariot yoked with white horses blew their divine conchs,then madhava krishna and the son of pandu arjuna stationed in their magnificent chariot with white horses yoked to it blew their divine conchs loudly,then madhava krishna and the son of pandu arjuna seated in the magnificent chariot yoked with white horses blew divine conches,then mounted on a mighty chariot yoked with white horses madhava krishna and the son of pandu arjuna blew their heavenly conch shells,then seated in their spacious war chariot yoked with white horses lord shri krishna and arjuna sounded their divine conch shells
1.15,Sanjay,पञचजनय हषकश दवदतत धनजय पणडर दधम महशङख भमकरम वकदर,sri krishna blew his conch pancajanya arjuna his devadatta and bhima of terrible deeds blew his great conch paundra,hrsikesa krsna blew the conch pancajanya dhananjaya arjuna blew the conch devadatta and vrkodara bhima of terrible deeds blew the great conch paundra,hrishikesha blew the panchajanya arjuna blew the devadatta and bhima the wolfbellied doer of terrible deeds blew the great conch paundra,hrsikesa krsna blew the pancajanya dhananjaya arjuna blew the devadatta and bhima of the terrible deeds blew the mighty conchshell paundra,lord shri krishna blew his panchajanya and arjuna blew his devadatta brave bheema blew his renowned shell poundra
1.16,Sanjay,अननतवजय रज कनतपतर यधषठर नकल सहदवशच सघषमणपषपक,king yudhisthira the son of kunti blew his conch anantavijaya and nakula and sahadeva blew their conchs sughosa and manipuspaka,king yudhisthira son of kunti blew the anantavijaya nakula and sahadeva blew the sughosa and the manipuspaka respectively,king yudhishthira the son of kunti blew the anantavijaya nakula and sahadeva blew the sughosha and the manipushpaka,kuntis son the king yudhisthira blew the anantavijaya nakula and sahadeva blew the sughosa and manipuspaka respectively,the king dharmaraja the son of kunti blew the anantavijaya nakula and sahadeva the sughosa and manipushpaka respectively
1.17,Sanjay,कशयशच परमषवस शखणड च महरथ धषटदयमन वरटशच सतयकशचपरजत,and the king of kasi the supreme bowman sikandi the mighty warrior dhrstadyumna and virata and satyaki the invincible,and the king of kashi wielding a great bow and the great chariotrider sikhandin dhrstadyumna virata and satyaki the unconquered,the king of kasi an excellent archer sikhandi the mighty carwarrior dhrishtadyumna virata and satyaki the unconquered,and the king of kasi a great archer and sikhandin a mighty warrior dhrstadyumna and the king of virata and the unconquered satyaki,and the maharaja of benares the great archer shikhandi the great soldier dhrishtayumna virata and satyaki the invincible one
1.18,Sanjay,दरपद दरपदयशच सरवश पथवपत सभदरशच महबह शङखनदधम पथकपथक,drupada and the sons of draupadi as well as the strongarmed son of subhadraall o king blew their respective conchs again and again,drupada and the sons of draupadi as well as the mightyarmed son of subhadra all of them together o king blew their respective conchs,drupada and the sons of draupadi o lord of the earth and the son of subhadra the mightyarmed blew their conches each separately,the pancala king a mighty archer and draupads five sons as well as the mightyarmed son of subhadra each blew their own conchshells individually,and o king drupadas sons droupadis sons and the great soldier soubhadra blew their conches
1.19,Sanjay,स घष धरतरषटरण हदयन वयदरयत नभशच पथव चव तमल वयननदयन,and that tumultuous uproar reverberating through heaven and earth rent the hearts of dhrtarastras sons,that tremendous sound pierced the hearts of the sons of dhrtarastra as it reverberated through the sky and the earth,the tumultuous sound rent the hearts of dhritarashtras party reverberating through both heaven and earth,resonating in both the sky and the earth the tumultuous sound shattered the hearts of dhrtarastras men,the tumult rent the hearts of the sons of dhritarashtra shaking heaven and earth with its echoing violence
1.20,Sanjay,अथ वयवसथतन दषटव धरतरषटरनकपधवज परवतत शसतरसपत धनरदयमय पणडव,then arjuna whose banner crest was hanuman on beholding the sons of dhrtarastra arrayed took up his bow while missiles were beginning to fly,o king thereafter seeing dhrtarastras men standing in their positions with all the weapons ready for action the son of pandu arjuna who had the insignia of hanuman on his chariotflag raised his bow and said the following to hrsikesa,then seeing the people of dhritarashtras party standing arrayed and the discharge of weapons about to begin arjuna the son of pandu whose ensign was a monkey took up his bow and said the following to krishna o lord of the earth,o king then observing dhrtarastras men arrayed when the armed clash had virtually begun at that time pandus son the monkeybannered one arjuna raising his bow spoke these sentences,then upon beholding the sons of dhritarashtra drawn up on the battlefield ready to fight arjuna whose flag bore the image of hanuman
1.21,Arjun,हषकश तद वकयमदमह महपत सनयरभयरमधय रथ सथपय मऽचयत,and he spoke o lord of the earth these words to sri krishna arjuna said draw up my chariot o krishna between the two armies,arjuna said o acyuta please place my chariot between both the armies,arjuna said o krishna place my chariot in the middle between the two armies so that i may behold those who stand here desirous to fight and know with whom i must fight when the battle is about to commence,arjuna said o acyuta please halt my chariot at a central place between the two armies so that i may scrutinize these men who are standing with a desire to fight and with whom i have to engage in this great wareffort,raising his bow he spoke this to the lord shri krishna o infallible lord of the earth please draw up my chariot between the two armies
1.22,Arjun,यवदतननरकषऽह यदधकमनवसथतन करमय सह यदधवयमसमनरणसमदयम,so that i may have a good look at those who are standing eager to fight and know with whom i must fight in this enterprise of war,until i survey those who stand intent on fighting and those who are about to engage in battle with me in this impending war,arjuna said o krishna place my chariot in the middle between the two armies so that i may behold those who stand here desirous to fight and know with whom i must fight when the battle is about to commence,i shall scrutinize those who are ready to fight who have assembled here and are eager to achieve in the battle what is dear to the evilminded son of dhrtarastra,so that i may observe those who must fight on my side and those who must fight against me
1.23,Arjun,यतसयमननवकषऽह य एतऽतर समगत धरतरषटरसय दरबदधरयदध परयचकरषव,i wish to see those gathered here ready to fight in this battle in order to please the evilminded son of dhrtarashtra,these who have assembled here and want to accomplish in the war what is dear to the perverted son of dhrtarastra i find them to be intent on fighting,for i desire to observe those who are assembled here to fight wishing to please in battle the evilminded duryodhanathe son of dhritarashtra,sanjaya said o descendant of bharata dhrtarastra thus instructed by gudakesa arjuna hrsikesa halted the best chariot at a place in between the two armies in front of bhisma and drona and all the rulers of the earth he then said o son of prtha behold these kurus assembled,and gaze upon this array of soldiers eager to please the sons of dhritarashtra who are sinful
1.24,Sanjay,एवमकत हषकश गडकशन भरत सनयरभयरमधय सथपयतव रथततमम,sanjaya said thus addressed by arjuna sri krishna drew up the best of chariots between the two armies in full view of bhisma drona and all the other kings o dhrtarastra he then said o arjuna behold these assembled kauravas,sanjaya said o scion of the line of bharata hrishikesa being told so by gudakesa arjuna placed the excellent chariot between the two armies in front of bhishma and drona as well as all the rulers of the earth and said o partha behold these assembled kurus,sanjaya said thus addressed by arjuna krishna stationed the best of chariots o dhritarashtra in the midst of the two armies,sanjaya said o descendant of bharata dhrtarastra thus instructed by gudakesa arjuna hrsikesa halted the best chariot at a place in between the two armies in front of bhisma and drona and all the rulers of the earth he then said o son of prtha behold these kurus assembled,sanjaya said having listened to arjunas request lord shri krishna drew up his bright chariot in the midst between the two armies
1.25,Sanjay,भषमदरणपरमखत सरवष च महकषतम उवच परथ पशयतनसमवतनकरनत,sanjaya said thus addressed by arjuna sri krishna drew up the best of chariots between the two armies in full view of bhisma drona and all the other kings o dhrtarastra he then said o arjuna behold these assembled kauravas,sanjaya said o scion of the line of bharata dhrtarashtra hrsikesa being told so by gudakesa arjuna placed the excellent chariot between the two armies in front of bhisma and drona as well as all the rulers of the earth and said o partha arjuna behold these assembled people of the kuru dynasty,in front of bhishma and drona and all the rulers of the earth he said o arjuna son of pritha behold these kurus gathered together,there in both the armies the son of prtha observed his fathers paternal grandfathers teachers maternal uncles brothers sons sons sons and comrades fathersinlaw and also friends,where bheeshma and drona had led all the rulers of the earth they spoke thus o arjuna behold these members of the family of kuru are assembled
1.26,Sanjay,ततरपशयतसथतनपरथ पतनथ पतमहन आचरयनमतलनभरतनपतरनपतरनसखसतथ,then as arjuna looked on he saw standing there fathers grandfathers teachers uncles brothers sons grandsons and comrades,then arjuna saw marshalled among both the armies his uncles grandfathers teachers maternal uncles brothers cousins sons grandsons comrades fathersinlaw and friends,then arjuna son of pritha saw there in the armies stationed fathers grandfathers teachers maternal uncles brothers sons grandsons and friends,noticing all those kinsmen arrayed in the army the son of kunti was overwhelmed with immense compassion and despondent he uttered this,there arjuna noticed fathers grandfathers uncles cousins sons grandsons teachers and friends
1.27,Sanjay,शवशरनसहदशचव सनयरभयरप तनसमकषय स कनतय सरवनबनधनवसथतन,fathersinlaw and dear friends in both armies when arjuna saw all these kinsmen arrayed,the son of kunti arjuna seeing all those relatives arrayed there became overwhelmed by supreme compassion and sorrowfully said this,he saw fathersinlaw and friends in both the armies the son of kunti arjuna seeing all those kinsmen thus standing arrayed spoke sorrowfully deeply filled with pity,arjuna said o krishna on seeing these warmongering kinsfolk of mine arrayed in the armies my limbs fail and my mouth goes dry,fathersinlaw and benefactors were arrayed on both sides and arjuna then gazed at all those kinsmen before him
1.28,Arjun,कपय परयऽऽवषट वषदननदमबरवत दषटवम सवजन कषण ययतस समपसथतम,he was filled with deep compassion and said these words in despair,arjuna said o krsna seeing these relatives and friends who have assembled here with the intention of fighting my limbs become languid and my mouth becomes completely dry,arjuna said o krishna seeing my kinsmen arrayed here eager to fight,shivers and goosebumps arise in my body the gandiva slips from my hand and my skin is burning all over,and his heart melted with pity and sadly he spoke o my lord when i see all these my own people thirsting for battle
1.29,Arjun,सदनत मम गतरण मख च परशषयत वपथशच शरर म रमहरषशच जयत,my limbs have weakened my mouth has become parched my body is trembling and my hairs are standing on end,and there is trembling in my body and my hair stands on end the gandiva bow slips from my hand and my skin burns intensely,my limbs fail my mouth is parched my body quivers and my hair stands on end,i am unable even to stand steady my mind seems to be confused and i see adverse omens o kesava,my limbs are failing me my throat is parched my body is trembling and my hair is standing on end
1.30,Arjun,गणडव सरसत हसतततवकचव परदहयत न च शकनमयवसथत भरमतव च म मन,the bow gandiva slips from my hand and my skin is burning i can no longer stand my mind seems to be reeling,moreover o kesava krishna i am not able to stand firmly and my mind seems to be whirling and i observe the omens to be adverse,the gandiva slips from my hand and my skin burns all over i am unable to stand and my mind is reeling as it were,i do not foresee any good in killing my own kinsmen in the battle o krsna i neither wish for victory nor kingdom nor the pleasures thereof,the bow gandiva slips from my hand and my skin burns i cannot remain still for my mind is in tumult
1.31,Arjun,नमततन च पशयम वपरतन कशव न च शरयऽनपशयम हतव सवजनमहव,i see kṛṣṇa inauspicious omens i foresee no good in slaying my kinsmen in battle,besides i do not see any good to be derived from killing my own people in battle o krsna i do not hanker after victory nor even a kingdom nor pleasures,and i see ill omens o kesava i do not see any good in slaying my kinsmen in battle,o govinda what use is the kingdom to us what use are its pleasures and life even,the omens are unfavorable what good can come from the slaughter of my people on this battlefield
